{
  "schema_version": "1.0",
  "document_type": "knowledge_handoff",
  "role": "knowledge",
  "task_id": "SYNTHETIC-KNOWLEDGE-TASK-1",
  "attempt": 1,
  "assignment": {
    "scope": "synthetic sample: compare two fictional raw findings and document a reusable test-plan lesson.",
    "completion_criteria": [
      "Record a supported adoption/defer/reject decision for each supplied finding."
    ]
  },
  "raw_findings": [
    {
      "id": "SYNTHETIC-RAW-1",
      "domain": "validation",
      "observation": "synthetic sample: fictional design 1 separates an empty-string case from a whitespace-only case.",
      "sources": [
        {
          "locator": "https://example.invalid/synthetic/design-1",
          "revision": "SYNTHETIC-REVISION-1"
        }
      ],
      "issue_refs": [
        {
          "id": "SYNTHETIC-ISSUE-1",
          "source": "https://example.invalid/synthetic/issues/1"
        }
      ]
    },
    {
      "id": "SYNTHETIC-RAW-2",
      "domain": "validation",
      "observation": "synthetic sample: fictional design 2 separates an empty-string case from a whitespace-only case.",
      "sources": [
        {
          "locator": "https://example.invalid/synthetic/design-2",
          "revision": "SYNTHETIC-REVISION-2"
        }
      ],
      "issue_refs": [
        {
          "id": "SYNTHETIC-ISSUE-2",
          "source": "https://example.invalid/synthetic/issues/2"
        }
      ]
    }
  ],
  "knowledge_references": [],
  "publication": "synthetic_sample",
  "retry_of": [],
  "system_status": "completed",
  "status": "completed",
  "summary": "synthetic sample: fictional cross-Issue curation; no actual task execution.",
  "artifacts": [
    {
      "id": "SYNTHETIC-KNOWLEDGE-ARTIFACT",
      "kind": "knowledge",
      "locator": "examples/knowledge/curated-example.md",
      "revision": "SYNTHETIC-ARTICLE-REVISION-1",
      "summary": "synthetic sample: draft reusable lesson from two fictional sources."
    }
  ],
  "evidence": [
    {
      "id": "SYNTHETIC-KNOWLEDGE-EVIDENCE",
      "claim": "synthetic sample: both supplied fictional findings distinguish empty from whitespace-only cases.",
      "artifact_ids": [
        "SYNTHETIC-KNOWLEDGE-ARTIFACT"
      ],
      "raw_finding_ids": [
        "SYNTHETIC-RAW-1",
        "SYNTHETIC-RAW-2"
      ],
      "locator": "examples/knowledge/curated-example.md",
      "observation": "Fictional comparison only. No actual product behavior is certified."
    }
  ],
  "decisions": [
    {
      "raw_finding_ids": [
        "SYNTHETIC-RAW-1",
        "SYNTHETIC-RAW-2"
      ],
      "outcome": "adopted",
      "reason": "synthetic sample: generalize only to test-plan review within the documented applicability.",
      "evidence_ids": [
        "SYNTHETIC-KNOWLEDGE-EVIDENCE"
      ],
      "article_artifact_ids": [
        "SYNTHETIC-KNOWLEDGE-ARTIFACT"
      ]
    }
  ],
  "block_reasons": [],
  "failure_reasons": []
}
